{
  "schemaVersion": "1.3.0",
  "id": "safety-positive",
  "name": "Barrier, alarm, separation, and withdrawal",
  "seed": 9,
  "pulseMs": 100,
  "maxTicks": 4,
  "map": {
    "width": 12,
    "height": 8,
    "obstacles": [
      {
        "id": "barrier",
        "x": 5,
        "y": 1,
        "width": 1,
        "height": 6,
        "blocksVision": true,
        "blocksMovement": true
      }
    ]
  },
  "threat": { "active": true, "endsAtTick": 2 },
  "actors": [
    {
      "id": "protected",
      "side": "protected",
      "position": { "x": 3, "y": 4 },
      "readiness": 0.7,
      "stamina": 1,
      "resolve": 0.8,
      "threatened": true,
      "policyId": "safety-first"
    }
  ]
}
